{
  "schema_version": "1.0.0",
  "dependency_id": "dependency-synthetic-001",
  "subject_id": "synthetic-subject-alpha",
  "configuration_digest": "sha256:abababababababababababababababababababababababababababababababab",
  "dependency_type": "synthetic replaceable component",
  "owner_ref": "synthetic-owner",
  "replacement_ref": "synthetic-replacement",
  "portability_basis": "bounded synthetic export and restore procedure",
  "switching_procedure_ref": "synthetic-switch-procedure",
  "recovery_basis_ref": "synthetic-recovery-basis",
  "exercise_started_at": "2026-10-15T00:00:00Z",
  "exercise_completed_at": "2026-10-15T01:00:00Z",
  "observed_switch_time": "synthetic 60 minutes",
  "fallback_available": true,
  "fallback_demonstrated": true,
  "recovery_demonstrated": true,
  "data_or_state_recovered": true,
  "residual_dependencies": [],
  "limitations": ["synthetic exercise only; supplier independence is not claimed"],
  "outcome": "SUCCESS",
  "evidence_refs": ["synthetic-exit-observation"],
  "reference_only": true,
  "human_review_required": true,
  "authority_effect": "NONE"
}
